{
  "schema_version": "launchrally.dev/reference-integration-pack/v1",
  "pack_id": "pack_queue_background_work",
  "pack_version": "1.0.0",
  "family": "queue_background_work",
  "product_shapes": [
    "subscription_saas",
    "media_productivity_async",
    "custom_self_hosted_web",
    "desktop_shared_backend"
  ],
  "capability_contract": {
    "contract_version": "launchrally.dev/capability-catalog/v1",
    "provider_fields": false
  },
  "integration_contract": {
    "contract_version": "launchrally.dev/integration-contract/v1",
    "provider_fields": false
  },
  "effects": {
    "allowed": [
      "provider_configuration_read",
      "source_write"
    ],
    "prohibited": [
      "credential_persistence",
      "deployment_write",
      "production_data_write",
      "provider_configuration_write"
    ]
  },
  "test_recipe_ids": [],
  "implementations": [
    {
      "implementation_id": "cloudflare_queues",
      "name": "Cloudflare Queues",
      "kind": "managed",
      "interface_version": "wrangler/4.122.0",
      "support_depth": "generic_contract",
      "read_adapter": null,
      "executor_descriptors": [
        {
          "id": "executor_codex_reference",
          "schema_version": "launchrally.dev/executor-descriptor/v1",
          "digest": "sha256:c00001281025da4c49431633c52a68f7043a3a6eb9c3f546a241ee53ba6beb04"
        },
        {
          "id": "executor_claude_reference",
          "schema_version": "launchrally.dev/executor-descriptor/v1",
          "digest": "sha256:7abb7b7649be159b9dde8258dcb540c0a3ad3f581d8cda327abfb02adc8e58f0"
        }
      ],
      "normalization_shape": "batched_queue_consumer",
      "normalization_fixture": {
        "fixture_id": "normalize_cloudflare_queues",
        "synthetic_input": {
          "shape": "batched_queue_consumer",
          "signals": [
            "configured",
            "retry_configured"
          ]
        },
        "required_signals": [
          "configured",
          "retry_configured"
        ],
        "expected_observation": {
          "configuration_state": "configured",
          "verification_state": "unverified"
        }
      },
      "official_sources": [
        {
          "title": "Cloudflare Queues",
          "url": "https://developers.cloudflare.com/queues/",
          "reviewed_at": "2026-08-14"
        }
      ]
    },
    {
      "implementation_id": "aws_sqs",
      "name": "Amazon SQS",
      "kind": "managed",
      "interface_version": "sqs-api/2012-11-05",
      "support_depth": "generic_contract",
      "read_adapter": null,
      "executor_descriptors": [
        {
          "id": "executor_codex_reference",
          "schema_version": "launchrally.dev/executor-descriptor/v1",
          "digest": "sha256:c00001281025da4c49431633c52a68f7043a3a6eb9c3f546a241ee53ba6beb04"
        },
        {
          "id": "executor_claude_reference",
          "schema_version": "launchrally.dev/executor-descriptor/v1",
          "digest": "sha256:7abb7b7649be159b9dde8258dcb540c0a3ad3f581d8cda327abfb02adc8e58f0"
        }
      ],
      "normalization_shape": "regional_dead_letter_queue",
      "normalization_fixture": {
        "fixture_id": "normalize_aws_sqs",
        "synthetic_input": {
          "shape": "regional_dead_letter_queue",
          "signals": [
            "configured",
            "dead_letter_configured"
          ]
        },
        "required_signals": [
          "configured",
          "dead_letter_configured"
        ],
        "expected_observation": {
          "configuration_state": "configured",
          "verification_state": "unverified"
        }
      },
      "official_sources": [
        {
          "title": "Amazon SQS API",
          "url": "https://docs.aws.amazon.com/AWSSimpleQueueService/latest/APIReference/API_ListQueues.html",
          "reviewed_at": "2026-08-14"
        }
      ]
    },
    {
      "implementation_id": "queue_background_work_retained",
      "name": "Retain existing implementation",
      "kind": "retained",
      "interface_version": "existing-contract/v1",
      "support_depth": "generic_contract",
      "read_adapter": null,
      "executor_descriptors": [],
      "normalization_shape": null,
      "normalization_fixture": null,
      "official_sources": [
        {
          "title": "LaunchRally generic contract",
          "url": "https://github.com/codeacme17/launchrally/tree/dev/packages/contracts",
          "reviewed_at": "2026-08-14"
        }
      ]
    },
    {
      "implementation_id": "queue_background_work_custom",
      "name": "Custom implementation",
      "kind": "custom",
      "interface_version": "generic-contract/v1",
      "support_depth": "generic_contract",
      "read_adapter": null,
      "executor_descriptors": [],
      "normalization_shape": null,
      "normalization_fixture": null,
      "official_sources": [
        {
          "title": "LaunchRally generic contract",
          "url": "https://github.com/codeacme17/launchrally/tree/dev/packages/contracts",
          "reviewed_at": "2026-08-14"
        }
      ]
    },
    {
      "implementation_id": "queue_background_work_self_hosted",
      "name": "Self-hosted implementation",
      "kind": "self_hosted",
      "interface_version": "generic-contract/v1",
      "support_depth": "generic_contract",
      "read_adapter": null,
      "executor_descriptors": [],
      "normalization_shape": null,
      "normalization_fixture": null,
      "official_sources": [
        {
          "title": "LaunchRally generic contract",
          "url": "https://github.com/codeacme17/launchrally/tree/dev/packages/contracts",
          "reviewed_at": "2026-08-14"
        }
      ]
    },
    {
      "implementation_id": "queue_background_work_unknown",
      "name": "Unknown implementation",
      "kind": "unknown",
      "interface_version": "unknown/v1",
      "support_depth": "transparent_gap",
      "read_adapter": null,
      "executor_descriptors": [],
      "normalization_shape": null,
      "normalization_fixture": null,
      "official_sources": [
        {
          "title": "LaunchRally generic contract",
          "url": "https://github.com/codeacme17/launchrally/tree/dev/packages/contracts",
          "reviewed_at": "2026-08-14"
        }
      ]
    }
  ],
  "fixture_outcomes": [
    {
      "fixture_id": "fixture_queue_background_work_complete",
      "outcome": "complete"
    },
    {
      "fixture_id": "fixture_queue_background_work_partial",
      "outcome": "partial"
    },
    {
      "fixture_id": "fixture_queue_background_work_denied",
      "outcome": "denied"
    },
    {
      "fixture_id": "fixture_queue_background_work_unknown",
      "outcome": "unknown"
    },
    {
      "fixture_id": "fixture_queue_background_work_stale",
      "outcome": "stale"
    },
    {
      "fixture_id": "fixture_queue_background_work_successful",
      "outcome": "successful"
    },
    {
      "fixture_id": "fixture_queue_background_work_failed",
      "outcome": "failed"
    },
    {
      "fixture_id": "fixture_queue_background_work_cleanup_failed",
      "outcome": "cleanup_failed"
    }
  ],
  "review": {
    "reviewed_at": "2026-08-14T00:00:00.000Z",
    "expires_at": "2026-11-12T00:00:00.000Z",
    "tamper_validation": true
  },
  "pack_digest": "sha256:80cfaba6a0881a16ed971f99d980e593f7fb7c6eb5a427d9e882832c7cd88b52"
}
