{
  "schema_version": "launchrally.dev/reference-integration-pack/v1",
  "pack_id": "pack_identity_to_application_data",
  "pack_version": "1.0.0",
  "family": "identity_to_application_data",
  "product_shapes": [
    "subscription_saas",
    "custom_self_hosted_web",
    "desktop_shared_backend"
  ],
  "capability_contract": {
    "contract_version": "launchrally.dev/capability-catalog/v1",
    "provider_fields": false
  },
  "integration_contract": {
    "contract_version": "launchrally.dev/integration-contract/v1",
    "provider_fields": false
  },
  "effects": {
    "allowed": [
      "provider_configuration_read",
      "source_write"
    ],
    "prohibited": [
      "credential_persistence",
      "deployment_write",
      "production_data_write",
      "provider_configuration_write"
    ]
  },
  "test_recipe_ids": [
    "recipe_test_user"
  ],
  "implementations": [
    {
      "implementation_id": "clerk",
      "name": "Clerk",
      "kind": "managed",
      "interface_version": "clerk-cli/3.1.0",
      "support_depth": "read_only",
      "read_adapter": "clerk-read/v1",
      "executor_descriptors": [
        {
          "id": "executor_codex_reference",
          "schema_version": "launchrally.dev/executor-descriptor/v1",
          "digest": "sha256:c00001281025da4c49431633c52a68f7043a3a6eb9c3f546a241ee53ba6beb04"
        },
        {
          "id": "executor_claude_reference",
          "schema_version": "launchrally.dev/executor-descriptor/v1",
          "digest": "sha256:7abb7b7649be159b9dde8258dcb540c0a3ad3f581d8cda327abfb02adc8e58f0"
        }
      ],
      "normalization_shape": "application_instance",
      "normalization_fixture": {
        "fixture_id": "normalize_clerk",
        "synthetic_input": {
          "shape": "application_instance",
          "signals": [
            "configured",
            "linked"
          ]
        },
        "required_signals": [
          "configured",
          "linked"
        ],
        "expected_observation": {
          "configuration_state": "configured",
          "verification_state": "unverified"
        }
      },
      "official_sources": [
        {
          "title": "Clerk Platform API",
          "url": "https://clerk.com/docs/reference/platform-api/tag/applications",
          "reviewed_at": "2026-08-14"
        }
      ]
    },
    {
      "implementation_id": "supabase_auth",
      "name": "Supabase Auth",
      "kind": "managed",
      "interface_version": "supabase-cli/2.114.0",
      "support_depth": "generic_contract",
      "read_adapter": null,
      "executor_descriptors": [
        {
          "id": "executor_codex_reference",
          "schema_version": "launchrally.dev/executor-descriptor/v1",
          "digest": "sha256:c00001281025da4c49431633c52a68f7043a3a6eb9c3f546a241ee53ba6beb04"
        },
        {
          "id": "executor_claude_reference",
          "schema_version": "launchrally.dev/executor-descriptor/v1",
          "digest": "sha256:7abb7b7649be159b9dde8258dcb540c0a3ad3f581d8cda327abfb02adc8e58f0"
        }
      ],
      "normalization_shape": "managed_auth_schema",
      "normalization_fixture": {
        "fixture_id": "normalize_supabase_auth",
        "synthetic_input": {
          "shape": "managed_auth_schema",
          "signals": [
            "configured",
            "policy_present"
          ]
        },
        "required_signals": [
          "configured",
          "policy_present"
        ],
        "expected_observation": {
          "configuration_state": "configured",
          "verification_state": "unverified"
        }
      },
      "official_sources": [
        {
          "title": "Supabase Auth architecture",
          "url": "https://supabase.com/docs/guides/auth/architecture",
          "reviewed_at": "2026-08-14"
        }
      ]
    },
    {
      "implementation_id": "identity_to_application_data_retained",
      "name": "Retain existing implementation",
      "kind": "retained",
      "interface_version": "existing-contract/v1",
      "support_depth": "generic_contract",
      "read_adapter": null,
      "executor_descriptors": [],
      "normalization_shape": null,
      "normalization_fixture": null,
      "official_sources": [
        {
          "title": "LaunchRally generic contract",
          "url": "https://github.com/codeacme17/launchrally/tree/dev/packages/contracts",
          "reviewed_at": "2026-08-14"
        }
      ]
    },
    {
      "implementation_id": "identity_to_application_data_custom",
      "name": "Custom implementation",
      "kind": "custom",
      "interface_version": "generic-contract/v1",
      "support_depth": "generic_contract",
      "read_adapter": null,
      "executor_descriptors": [],
      "normalization_shape": null,
      "normalization_fixture": null,
      "official_sources": [
        {
          "title": "LaunchRally generic contract",
          "url": "https://github.com/codeacme17/launchrally/tree/dev/packages/contracts",
          "reviewed_at": "2026-08-14"
        }
      ]
    },
    {
      "implementation_id": "identity_to_application_data_self_hosted",
      "name": "Self-hosted implementation",
      "kind": "self_hosted",
      "interface_version": "generic-contract/v1",
      "support_depth": "generic_contract",
      "read_adapter": null,
      "executor_descriptors": [],
      "normalization_shape": null,
      "normalization_fixture": null,
      "official_sources": [
        {
          "title": "LaunchRally generic contract",
          "url": "https://github.com/codeacme17/launchrally/tree/dev/packages/contracts",
          "reviewed_at": "2026-08-14"
        }
      ]
    },
    {
      "implementation_id": "identity_to_application_data_unknown",
      "name": "Unknown implementation",
      "kind": "unknown",
      "interface_version": "unknown/v1",
      "support_depth": "transparent_gap",
      "read_adapter": null,
      "executor_descriptors": [],
      "normalization_shape": null,
      "normalization_fixture": null,
      "official_sources": [
        {
          "title": "LaunchRally generic contract",
          "url": "https://github.com/codeacme17/launchrally/tree/dev/packages/contracts",
          "reviewed_at": "2026-08-14"
        }
      ]
    }
  ],
  "fixture_outcomes": [
    {
      "fixture_id": "fixture_identity_to_application_data_complete",
      "outcome": "complete"
    },
    {
      "fixture_id": "fixture_identity_to_application_data_partial",
      "outcome": "partial"
    },
    {
      "fixture_id": "fixture_identity_to_application_data_denied",
      "outcome": "denied"
    },
    {
      "fixture_id": "fixture_identity_to_application_data_unknown",
      "outcome": "unknown"
    },
    {
      "fixture_id": "fixture_identity_to_application_data_stale",
      "outcome": "stale"
    },
    {
      "fixture_id": "fixture_identity_to_application_data_successful",
      "outcome": "successful"
    },
    {
      "fixture_id": "fixture_identity_to_application_data_failed",
      "outcome": "failed"
    },
    {
      "fixture_id": "fixture_identity_to_application_data_cleanup_failed",
      "outcome": "cleanup_failed"
    }
  ],
  "review": {
    "reviewed_at": "2026-08-14T00:00:00.000Z",
    "expires_at": "2026-11-12T00:00:00.000Z",
    "tamper_validation": true
  },
  "pack_digest": "sha256:7f3b286cd4c96a8d61bd1e4afcff049ddf715b98060a11836923efa964090563"
}
