{
  "schema_version": "launchrally.dev/reference-integration-pack/v1",
  "pack_id": "pack_release_to_observability",
  "pack_version": "1.0.0",
  "family": "release_to_observability",
  "product_shapes": [
    "content_marketing_web",
    "subscription_saas",
    "media_productivity_async",
    "custom_self_hosted_web",
    "desktop_shared_backend"
  ],
  "capability_contract": {
    "contract_version": "launchrally.dev/capability-catalog/v1",
    "provider_fields": false
  },
  "integration_contract": {
    "contract_version": "launchrally.dev/integration-contract/v1",
    "provider_fields": false
  },
  "effects": {
    "allowed": [
      "provider_configuration_read",
      "source_write"
    ],
    "prohibited": [
      "credential_persistence",
      "deployment_write",
      "production_data_write",
      "provider_configuration_write"
    ]
  },
  "test_recipe_ids": [],
  "implementations": [
    {
      "implementation_id": "sentry",
      "name": "Sentry",
      "kind": "managed",
      "interface_version": "sentry-cli/3.6.2",
      "support_depth": "read_only",
      "read_adapter": "sentry-read/v1",
      "executor_descriptors": [
        {
          "id": "executor_codex_reference",
          "schema_version": "launchrally.dev/executor-descriptor/v1",
          "digest": "sha256:c00001281025da4c49431633c52a68f7043a3a6eb9c3f546a241ee53ba6beb04"
        },
        {
          "id": "executor_claude_reference",
          "schema_version": "launchrally.dev/executor-descriptor/v1",
          "digest": "sha256:7abb7b7649be159b9dde8258dcb540c0a3ad3f581d8cda327abfb02adc8e58f0"
        }
      ],
      "normalization_shape": "release_record",
      "normalization_fixture": {
        "fixture_id": "normalize_sentry",
        "synthetic_input": {
          "shape": "release_record",
          "signals": [
            "configured",
            "observable"
          ]
        },
        "required_signals": [
          "configured",
          "observable"
        ],
        "expected_observation": {
          "configuration_state": "configured",
          "verification_state": "unverified"
        }
      },
      "official_sources": [
        {
          "title": "Sentry Releases API",
          "url": "https://docs.sentry.io/api/releases/",
          "reviewed_at": "2026-08-14"
        }
      ]
    },
    {
      "implementation_id": "honeycomb",
      "name": "Honeycomb",
      "kind": "managed",
      "interface_version": "honeycomb-api/v1",
      "support_depth": "generic_contract",
      "read_adapter": null,
      "executor_descriptors": [
        {
          "id": "executor_codex_reference",
          "schema_version": "launchrally.dev/executor-descriptor/v1",
          "digest": "sha256:c00001281025da4c49431633c52a68f7043a3a6eb9c3f546a241ee53ba6beb04"
        },
        {
          "id": "executor_claude_reference",
          "schema_version": "launchrally.dev/executor-descriptor/v1",
          "digest": "sha256:7abb7b7649be159b9dde8258dcb540c0a3ad3f581d8cda327abfb02adc8e58f0"
        }
      ],
      "normalization_shape": "deployment_marker",
      "normalization_fixture": {
        "fixture_id": "normalize_honeycomb",
        "synthetic_input": {
          "shape": "deployment_marker",
          "signals": [
            "linked",
            "observable"
          ]
        },
        "required_signals": [
          "linked",
          "observable"
        ],
        "expected_observation": {
          "configuration_state": "configured",
          "verification_state": "unverified"
        }
      },
      "official_sources": [
        {
          "title": "Honeycomb markers API",
          "url": "https://docs.honeycomb.io/api/markers/list-all-markers",
          "reviewed_at": "2026-08-14"
        }
      ]
    },
    {
      "implementation_id": "release_to_observability_retained",
      "name": "Retain existing implementation",
      "kind": "retained",
      "interface_version": "existing-contract/v1",
      "support_depth": "generic_contract",
      "read_adapter": null,
      "executor_descriptors": [],
      "normalization_shape": null,
      "normalization_fixture": null,
      "official_sources": [
        {
          "title": "LaunchRally generic contract",
          "url": "https://github.com/codeacme17/launchrally/tree/dev/packages/contracts",
          "reviewed_at": "2026-08-14"
        }
      ]
    },
    {
      "implementation_id": "release_to_observability_custom",
      "name": "Custom implementation",
      "kind": "custom",
      "interface_version": "generic-contract/v1",
      "support_depth": "generic_contract",
      "read_adapter": null,
      "executor_descriptors": [],
      "normalization_shape": null,
      "normalization_fixture": null,
      "official_sources": [
        {
          "title": "LaunchRally generic contract",
          "url": "https://github.com/codeacme17/launchrally/tree/dev/packages/contracts",
          "reviewed_at": "2026-08-14"
        }
      ]
    },
    {
      "implementation_id": "release_to_observability_self_hosted",
      "name": "Self-hosted implementation",
      "kind": "self_hosted",
      "interface_version": "generic-contract/v1",
      "support_depth": "generic_contract",
      "read_adapter": null,
      "executor_descriptors": [],
      "normalization_shape": null,
      "normalization_fixture": null,
      "official_sources": [
        {
          "title": "LaunchRally generic contract",
          "url": "https://github.com/codeacme17/launchrally/tree/dev/packages/contracts",
          "reviewed_at": "2026-08-14"
        }
      ]
    },
    {
      "implementation_id": "release_to_observability_unknown",
      "name": "Unknown implementation",
      "kind": "unknown",
      "interface_version": "unknown/v1",
      "support_depth": "transparent_gap",
      "read_adapter": null,
      "executor_descriptors": [],
      "normalization_shape": null,
      "normalization_fixture": null,
      "official_sources": [
        {
          "title": "LaunchRally generic contract",
          "url": "https://github.com/codeacme17/launchrally/tree/dev/packages/contracts",
          "reviewed_at": "2026-08-14"
        }
      ]
    }
  ],
  "fixture_outcomes": [
    {
      "fixture_id": "fixture_release_to_observability_complete",
      "outcome": "complete"
    },
    {
      "fixture_id": "fixture_release_to_observability_partial",
      "outcome": "partial"
    },
    {
      "fixture_id": "fixture_release_to_observability_denied",
      "outcome": "denied"
    },
    {
      "fixture_id": "fixture_release_to_observability_unknown",
      "outcome": "unknown"
    },
    {
      "fixture_id": "fixture_release_to_observability_stale",
      "outcome": "stale"
    },
    {
      "fixture_id": "fixture_release_to_observability_successful",
      "outcome": "successful"
    },
    {
      "fixture_id": "fixture_release_to_observability_failed",
      "outcome": "failed"
    },
    {
      "fixture_id": "fixture_release_to_observability_cleanup_failed",
      "outcome": "cleanup_failed"
    }
  ],
  "review": {
    "reviewed_at": "2026-08-14T00:00:00.000Z",
    "expires_at": "2026-11-12T00:00:00.000Z",
    "tamper_validation": true
  },
  "pack_digest": "sha256:d6b61c41761be7ecd88a70643f5a58079ce8962bde3894aed28d17d66a1c5d91"
}
